{
  "schema_version": "0.1",
  "canonical_mapping_status": "ACTIVE",
  "canonical_mapping_approved": true,
  "executable": false,
  "product_consumable": false,
  "probability_status": "UNKNOWN",
  "supersession": {
    "supersedes": [],
    "superseded_by": [],
    "reason": null
  },
  "mapping_id": "KMM-000003",
  "primary_source_rule_id": "CA05-469",
  "source_rule_ids": [
    "CA05-469"
  ],
  "manifestation_id": "KMN-000003",
  "source_refs": [
    "SRC-ZZ-003#pdf_scan_page=72#printed_page=144#CA05-469",
    "knowledge/palaces/P09_career/wp06c/P09_WP06C_SOURCE_CANDIDATE_INDEX_v0.1.json#P09-WP06C-CAND-003"
  ],
  "review_refs": {
    "positive": [
      "MR-P09-CA05469-SCENE-001"
    ],
    "negative_boundaries": [
      "MR-P09-CA05469-INJURY-NEG-002"
    ]
  },
  "source_epistemic": "EXPLICIT",
  "normalization_epistemic": "INFERRED",
  "output_kind": {
    "state": "KNOWN",
    "value": "SCENE_OR_CONTEXT"
  },
  "event_specificity": {
    "state": "KNOWN",
    "value": "SCENE_NOT_OBSERVED_EVENT"
  },
  "conditions": {
    "time_layer": "NATAL",
    "source_condition_text": "廉贞化忌",
    "antecedent_rule_ids": [],
    "modality_terms": [],
    "real_world_prerequisites": [],
    "unresolved_semantics": []
  },
  "execution_readiness": "KNOWLEDGE_READY_RUNTIME_NOT_AUTHORIZED",
  "execution_blockers": [
    "PRODUCT_RUNTIME_NOT_AUTHORIZED"
  ],
  "forbidden_inferences": [
    "Do not map this career/industry scene to a person-level injury, illness, accident, diagnosis, treatment, or medical event.",
    "Do not treat source symbolism as an observed real-world event.",
    "Do not add probability, frequency, numeric strength, or empirical predictive-validity claims."
  ]
}
