{
  "schema_version": "0.1",
  "mapping_id": "KMM-000009",
  "primary_source_rule_id": "P01-750",
  "source_rule_ids": [
    "P01-750"
  ],
  "manifestation_id": "KMN-000009",
  "source_refs": [
    "SRC-ZZ-003#printed_page=24#P01-750",
    "knowledge/palaces/P01_life/wp05/LIFE_P08_SOURCE_READJUDICATION_701_800_v0.1.csv#P01-750"
  ],
  "review_refs": {
    "positive": [
      "MR-C1B1-P01750-TEMPORAL-POS"
    ],
    "negative_boundaries": [
      "MR-C1B1-P01750-EVENT-NEG"
    ]
  },
  "source_epistemic": "EXPLICIT",
  "normalization_epistemic": "SOURCE_PRESERVING",
  "output_kind": {
    "state": "KNOWN",
    "value": "TEMPORAL_HINGE_STRUCTURE"
  },
  "event_specificity": {
    "state": "KNOWN",
    "value": "TEMPORAL_WINDOW_NOT_OBSERVED_EVENT"
  },
  "conditions": {
    "time_layer": "DECADE_YEAR",
    "source_condition_text": "辰戌宫破军；七杀、贪狼、[紫相]、[天机巨门]宫垣",
    "antecedent_rule_ids": [],
    "modality_terms": [],
    "real_world_prerequisites": [],
    "unresolved_semantics": []
  },
  "canonical_mapping_status": "ACTIVE",
  "canonical_mapping_approved": true,
  "execution_readiness": "KNOWLEDGE_READY_RUNTIME_NOT_AUTHORIZED",
  "executable": false,
  "execution_blockers": [
    "PRODUCT_RUNTIME_NOT_AUTHORIZED"
  ],
  "product_consumable": false,
  "probability_status": "UNKNOWN",
  "forbidden_inferences": [
    "Do not treat a 枢纽 window as proof that any specific event occurs.",
    "Do not assign favorable/adverse valence unless separately supported by a source rule.",
    "Do not collapse the explicit 大限与流年 dual layer into only one time scale."
  ],
  "supersession": {
    "supersedes": [],
    "superseded_by": [],
    "reason": null
  }
}
