{
  "schema_version": "0.1",
  "mapping_id": "KMM-000012",
  "primary_source_rule_id": "P01-SG-180",
  "source_rule_ids": [
    "P01-SG-180"
  ],
  "manifestation_id": "KMN-000012",
  "source_refs": [
    "SRC-ZZ-003#printed_page=18#P01-SG-180",
    "knowledge/palaces/P01_life/wp05/LIFE_P06_SOURCE_GAP_SUPPLEMENT_PP17_20_v0.1.csv#P01-SG-180"
  ],
  "review_refs": {
    "positive": [
      "MR-C1B2-P01SG180-PROCESS-POS"
    ],
    "negative_boundaries": [
      "MR-C1B2-P01SG180-EVENT-NEG"
    ]
  },
  "source_epistemic": "EXPLICIT",
  "normalization_epistemic": "SOURCE_PRESERVING",
  "output_kind": {
    "state": "KNOWN",
    "value": "MULTI_VARIANT_FRICTION_SETBACK_PATTERN"
  },
  "event_specificity": {
    "state": "KNOWN",
    "value": "ABSTRACT_PROCESS_PATTERN_NOT_OBSERVED_EVENT"
  },
  "conditions": {
    "time_layer": "NATAL",
    "source_condition_text": "天相最重夹宫；羊陀夹、火铃夹、空劫夹皆不吉",
    "antecedent_rule_ids": [],
    "modality_terms": [],
    "real_world_prerequisites": [],
    "unresolved_semantics": []
  },
  "canonical_mapping_status": "ACTIVE",
  "canonical_mapping_approved": true,
  "execution_readiness": "KNOWLEDGE_READY_RUNTIME_NOT_AUTHORIZED",
  "executable": false,
  "execution_blockers": [
    "PRODUCT_RUNTIME_NOT_AUTHORIZED"
  ],
  "product_consumable": false,
  "probability_status": "UNKNOWN",
  "forbidden_inferences": [
    "Do not require 羊陀夹、火铃夹、空劫夹 to occur together; the source lists them as separate adverse夹宫 variants.",
    "Do not turn 是非困扰、劳碌奔波、突生挫折 into claims that a specific dispute, travel episode, or failure occurred.",
    "Do not assign severity, frequency, probability, or timing."
  ],
  "supersession": {
    "supersedes": [],
    "superseded_by": [],
    "reason": null
  }
}
