{
  "schema_version": "0.1",
  "mapping_id": "KMM-000010",
  "primary_source_rule_id": "P01-SG-169",
  "source_rule_ids": [
    "P01-SG-169"
  ],
  "manifestation_id": "KMN-000010",
  "source_refs": [
    "SRC-ZZ-003#printed_page=17#P01-SG-169",
    "knowledge/palaces/P01_life/wp05/LIFE_P06_SOURCE_GAP_SUPPLEMENT_PP17_20_v0.1.csv#P01-SG-169"
  ],
  "review_refs": {
    "positive": [
      "MR-C1B2-P01SG169-TIMING-POS"
    ],
    "negative_boundaries": [
      "MR-C1B2-P01SG169-EVENT-NEG"
    ]
  },
  "source_epistemic": "EXPLICIT",
  "normalization_epistemic": "SOURCE_PRESERVING",
  "output_kind": {
    "state": "KNOWN",
    "value": "DECADE_BREAKTHROUGH_WINDOW"
  },
  "event_specificity": {
    "state": "KNOWN",
    "value": "TEMPORAL_WINDOW_NOT_OBSERVED_EVENT"
  },
  "conditions": {
    "time_layer": "DECADE",
    "source_condition_text": "辰宫巨门化禄；行至天府宫垣",
    "antecedent_rule_ids": [],
    "modality_terms": [],
    "real_world_prerequisites": [],
    "unresolved_semantics": []
  },
  "canonical_mapping_status": "ACTIVE",
  "canonical_mapping_approved": true,
  "execution_readiness": "KNOWLEDGE_READY_RUNTIME_NOT_AUTHORIZED",
  "executable": false,
  "execution_blockers": [
    "PRODUCT_RUNTIME_NOT_AUTHORIZED"
  ],
  "product_consumable": false,
  "probability_status": "UNKNOWN",
  "forbidden_inferences": [
    "Do not convert 发迹大运 into a guaranteed observed career, wealth, promotion, or status event.",
    "Do not infer a specific age, calendar year, probability, or duration from the decade-window statement.",
    "Do not generalize the 天府宫垣 trigger beyond the stated 辰宫巨门化禄 context."
  ],
  "supersession": {
    "supersedes": [],
    "superseded_by": [],
    "reason": null
  }
}
