{
  "schema_version": "0.1",
  "mapping_id": "KMM-000014",
  "primary_source_rule_id": "P02S-137",
  "source_rule_ids": [
    "P02S-137"
  ],
  "manifestation_id": "KMN-000014",
  "source_refs": [
    "SRC-ZZ-003#printed_page=27#P02S-137",
    "knowledge/palaces/P02_siblings/wp05/SIBLINGS_SB04_WUQU_SOURCE_AUDIT_v0.1.json#P02S-137"
  ],
  "review_refs": {
    "positive": [
      "MR-C1B2-P02S137-RELATION-POS"
    ],
    "negative_boundaries": [
      "MR-C1B2-P02S137-CROSSPALACE-NEG"
    ]
  },
  "source_epistemic": "EXPLICIT",
  "normalization_epistemic": "SOURCE_PRESERVING",
  "output_kind": {
    "state": "KNOWN",
    "value": "CROSS_PALACE_RELATIONAL_SUPPORT_EXCEPTION"
  },
  "event_specificity": {
    "state": "KNOWN",
    "value": "QUALITATIVE_RELATIONAL_PATTERN_NOT_OBSERVED_EVENT"
  },
  "conditions": {
    "time_layer": "NATAL",
    "source_condition_text": "子午[武府]见吉化；亦不为助力，除非命宫见辅弼，然后始有兄弟友人相助",
    "antecedent_rule_ids": [],
    "modality_terms": [
      "除非"
    ],
    "real_world_prerequisites": [],
    "unresolved_semantics": []
  },
  "canonical_mapping_status": "ACTIVE",
  "canonical_mapping_approved": true,
  "execution_readiness": "KNOWLEDGE_READY_RUNTIME_NOT_AUTHORIZED",
  "executable": false,
  "execution_blockers": [
    "PRODUCT_RUNTIME_NOT_AUTHORIZED"
  ],
  "product_consumable": false,
  "probability_status": "UNKNOWN",
  "forbidden_inferences": [
    "Do not conflate 子午武府见吉化 with the distinct 命宫见辅弼 cross-palace exception.",
    "Do not infer that a specific sibling, friend, or colleague actually provided assistance.",
    "Do not generalize this exception to other star systems or palace configurations."
  ],
  "supersession": {
    "supersedes": [],
    "superseded_by": [],
    "reason": null
  }
}
