{
  "schema_version": "0.1",
  "mapping_id": "KMM-000008",
  "primary_source_rule_id": "P01-727",
  "source_rule_ids": [
    "P01-727"
  ],
  "manifestation_id": "KMN-000008",
  "source_refs": [
    "SRC-ZZ-003#printed_page=23#P01-727",
    "knowledge/palaces/P01_life/wp05/LIFE_P08_SOURCE_READJUDICATION_701_800_v0.1.csv#P01-727"
  ],
  "review_refs": {
    "positive": [
      "MR-C1B1-P01727-CONDITIONAL-POS"
    ],
    "negative_boundaries": [
      "MR-C1B1-P01727-EVENT-NEG"
    ]
  },
  "source_epistemic": "EXPLICIT",
  "normalization_epistemic": "SOURCE_PRESERVING",
  "output_kind": {
    "state": "KNOWN",
    "value": "CONDITIONAL_CONFIGURATION_STATE"
  },
  "event_specificity": {
    "state": "KNOWN",
    "value": "ABSTRACT_CONFIGURATION_NOT_OBSERVED_EVENT"
  },
  "conditions": {
    "time_layer": "NATAL",
    "source_condition_text": "子午宫破军；廉贞化忌，或天相为刑忌所夹",
    "antecedent_rule_ids": [],
    "modality_terms": [
      "唯若"
    ],
    "real_world_prerequisites": [],
    "unresolved_semantics": []
  },
  "canonical_mapping_status": "ACTIVE",
  "canonical_mapping_approved": true,
  "execution_readiness": "KNOWLEDGE_READY_RUNTIME_NOT_AUTHORIZED",
  "executable": false,
  "execution_blockers": [
    "PRODUCT_RUNTIME_NOT_AUTHORIZED"
  ],
  "product_consumable": false,
  "probability_status": "UNKNOWN",
  "forbidden_inferences": [
    "Do not collapse the source-explicit 或 into an AND requirement.",
    "Do not reinterpret 败局 as proof that a specific real-world failure, loss, dismissal, bankruptcy, or other concrete event occurred.",
    "Do not generalize the condition beyond the stated 子午宫破军 context or assign probability, severity, or timing."
  ],
  "supersession": {
    "supersedes": [],
    "superseded_by": [],
    "reason": null
  }
}
