{
  "schema_version": "0.1",
  "mapping_id": "KMM-000006",
  "primary_source_rule_id": "P01-SG-213",
  "source_rule_ids": [
    "P01-SG-213"
  ],
  "manifestation_id": "KMN-000006",
  "source_refs": [
    "SRC-ZZ-003#printed_page=22#P01-SG-213",
    "knowledge/palaces/P01_life/wp05/LIFE_P07_SOURCE_GAP_SUPPLEMENT_PP20_22_v0.1.csv#P01-SG-213"
  ],
  "review_refs": {
    "positive": [
      "MR-C1B1-P01SG213-MODIFIER-POS"
    ],
    "negative_boundaries": [
      "MR-C1B1-P01SG213-WEIGHT-NEG"
    ]
  },
  "source_epistemic": "EXPLICIT",
  "normalization_epistemic": "SOURCE_PRESERVING",
  "output_kind": {
    "state": "KNOWN",
    "value": "MODIFIER_CONTEXT"
  },
  "event_specificity": {
    "state": "KNOWN",
    "value": "ABSTRACT_INTERPRETIVE_MODIFIER"
  },
  "conditions": {
    "time_layer": "NATAL",
    "source_condition_text": "七杀星系；考察贪狼及其星系组合对七杀的影响",
    "antecedent_rule_ids": [],
    "modality_terms": [
      "往往"
    ],
    "real_world_prerequisites": [],
    "unresolved_semantics": []
  },
  "canonical_mapping_status": "ACTIVE",
  "canonical_mapping_approved": true,
  "execution_readiness": "KNOWLEDGE_READY_RUNTIME_NOT_AUTHORIZED",
  "executable": false,
  "execution_blockers": [
    "PRODUCT_RUNTIME_NOT_AUTHORIZED"
  ],
  "product_consumable": false,
  "probability_status": "UNKNOWN",
  "forbidden_inferences": [
    "Do not encode 关系甚大 as a numeric weight, probability, or universal effect size.",
    "Do not infer a fixed favorable or adverse direction when the source sentence only establishes material influence.",
    "Do not generalize the modifier beyond the stated 七杀/贪狼 context."
  ],
  "supersession": {
    "supersedes": [],
    "superseded_by": [],
    "reason": null
  }
}
